{
  "version": "1.0.0",
  "dimension_scores": {
    "tracking": 4.75,
    "attribution": 1,
    "reporting": 4,
    "experimentation": 4,
    "lifecycle": 4,
    "infrastructure": 4.5
  },
  "base_overall_score": 3.71,
  "overall_score": 2.5,
  "weakest_link_applied": true,
  "min_dimension": {
    "dimension_id": "attribution",
    "score": 1
  },
  "primary_gap": {
    "dimension_id": "attribution",
    "score": 1
  },
  "critical_gaps": [
    {
      "dimension_id": "attribution",
      "score": 1
    }
  ],
  "foundation_gaps": [
    {
      "dimension_id": "attribution",
      "score": 1
    }
  ],
  "level": {
    "level": 3,
    "key": "systematic"
  },
  "cta": {
    "cta_tone": "warm",
    "reason": "One foundational gap (1 dimension <2.0)."
  }
}
